{
  "$schema": "https://json-schema.org/draft/2020-12/schema",
  "$id": "https://momentive-bi-digest.invalid/contracts/SalesforceCaseResponse.schema.json",
  "title": "SalesforceCaseResponse",
  "description": "Response of the sfdc_get_case MCP tool. comments contains ONLY IsPublished = true rows, because the server puts that clause in the SOQL rather than filtering after the fact. meta.withheld_comment_count is how the withholding becomes a number in the audit log.",
  "type": "object",
  "properties": {
    "schema_version": {
      "const": "1.0.0",
      "type": "string",
      "description": "Contract version of this document. Bump minor for an additive change, major for a breaking one."
    },
    "case": {
      "type": "object",
      "properties": {
        "attributes": {
          "type": "object",
          "properties": {
            "type": {
              "const": "Case",
              "type": "string"
            },
            "url": {
              "type": "string",
              "minLength": 1,
              "maxLength": 300
            }
          },
          "required": [
            "type",
            "url"
          ],
          "additionalProperties": false
        },
        "Id": {
          "type": "string",
          "pattern": "^[a-zA-Z0-9]{15,18}$"
        },
        "CaseNumber": {
          "type": "string",
          "minLength": 1,
          "maxLength": 30
        },
        "AccountId": {
          "type": "string",
          "pattern": "^[a-zA-Z0-9]{15,18}$"
        },
        "Subject": {
          "type": "string",
          "minLength": 0,
          "maxLength": 300
        },
        "Status": {
          "type": "string",
          "enum": [
            "New",
            "Working",
            "Escalated",
            "Closed"
          ]
        },
        "Priority": {
          "type": "string",
          "enum": [
            "High",
            "Medium",
            "Low"
          ]
        },
        "CreatedDate": {
          "type": "string",
          "pattern": "^\\d{4}-\\d{2}-\\d{2}T\\d{2}:\\d{2}:\\d{2}(\\.\\d{1,6})?(Z|[+-]\\d{2}:\\d{2})$"
        },
        "ClosedDate": {
          "type": [
            "string",
            "null"
          ],
          "pattern": "^\\d{4}-\\d{2}-\\d{2}T\\d{2}:\\d{2}:\\d{2}(\\.\\d{1,6})?(Z|[+-]\\d{2}:\\d{2})$"
        }
      },
      "required": [
        "attributes",
        "Id",
        "CaseNumber",
        "AccountId",
        "Subject",
        "Status",
        "Priority",
        "CreatedDate",
        "ClosedDate"
      ],
      "additionalProperties": false
    },
    "comments": {
      "type": "array",
      "items": {
        "type": "object",
        "properties": {
          "attributes": {
            "type": "object",
            "properties": {
              "type": {
                "const": "CaseComment",
                "type": "string"
              },
              "url": {
                "type": "string",
                "minLength": 1,
                "maxLength": 300
              }
            },
            "required": [
              "type",
              "url"
            ],
            "additionalProperties": false
          },
          "Id": {
            "type": "string",
            "pattern": "^[a-zA-Z0-9]{15,18}$"
          },
          "ParentId": {
            "type": "string",
            "pattern": "^[a-zA-Z0-9]{15,18}$",
            "description": "The Case Id this comment belongs to."
          },
          "CommentBody": {
            "type": "string",
            "minLength": 0,
            "maxLength": 20000
          },
          "IsPublished": {
            "type": "boolean",
            "description": "Salesforce's own flag. False means private to internal users. The connector's SOQL carries IsPublished = true, so a false comment is never in the result set."
          },
          "CreatedById": {
            "type": "string",
            "pattern": "^[a-zA-Z0-9]{15,18}$"
          },
          "CreatedDate": {
            "type": "string",
            "pattern": "^\\d{4}-\\d{2}-\\d{2}T\\d{2}:\\d{2}:\\d{2}(\\.\\d{1,6})?(Z|[+-]\\d{2}:\\d{2})$"
          }
        },
        "required": [
          "attributes",
          "Id",
          "ParentId",
          "CommentBody",
          "IsPublished",
          "CreatedById",
          "CreatedDate"
        ],
        "additionalProperties": false
      },
      "minItems": 0,
      "maxItems": 200
    },
    "meta": {
      "type": "object",
      "properties": {
        "window": {
          "type": "object",
          "properties": {
            "from": {
              "type": "string",
              "pattern": "^\\d{4}-\\d{2}-\\d{2}T\\d{2}:\\d{2}:\\d{2}(\\.\\d{1,6})?(Z|[+-]\\d{2}:\\d{2})$"
            },
            "to": {
              "type": "string",
              "pattern": "^\\d{4}-\\d{2}-\\d{2}T\\d{2}:\\d{2}:\\d{2}(\\.\\d{1,6})?(Z|[+-]\\d{2}:\\d{2})$"
            }
          },
          "required": [
            "from",
            "to"
          ],
          "additionalProperties": false
        },
        "rows_returned": {
          "type": "integer",
          "minimum": 0
        },
        "row_cap": {
          "type": "integer",
          "minimum": 1
        },
        "withheld_comment_count": {
          "type": [
            "integer",
            "null"
          ],
          "minimum": 0
        },
        "fields_allowlisted": {
          "type": "array",
          "items": {
            "type": "string",
            "minLength": 1,
            "maxLength": 80
          },
          "minItems": 1,
          "uniqueItems": true
        },
        "soql": {
          "type": "string",
          "minLength": 1,
          "maxLength": 2000,
          "description": "The exact SOQL executed. For a comment query it contains IsPublished = true."
        }
      },
      "required": [
        "window",
        "rows_returned",
        "row_cap",
        "withheld_comment_count",
        "fields_allowlisted",
        "soql"
      ],
      "additionalProperties": false
    }
  },
  "required": [
    "schema_version",
    "case",
    "comments",
    "meta"
  ],
  "additionalProperties": false
}
