{
  "schema_version": "1.0.0",
  "case": {
    "attributes": {
      "type": "Case",
      "url": "/services/data/v62.0/sobjects/Case/5008W00002aQpLrQAK"
    },
    "Id": "5008W00002aQpLrQAK",
    "CaseNumber": "00001042",
    "AccountId": "0018W00002HkLmNQAV",
    "Subject": "Renewal invoice missing prior dues credit",
    "Status": "Working",
    "Priority": "High",
    "CreatedDate": "2026-09-10T13:58:41.000Z",
    "ClosedDate": null
  },
  "comments": [
    {
      "attributes": {
        "type": "CaseComment",
        "url": "/services/data/v62.0/sobjects/CaseComment/00a8W00000XfT2mQAF"
      },
      "Id": "00a8W00000XfT2mQAF",
      "ParentId": "5008W00002aQpLrQAK",
      "CommentBody": "The credit from the part year membership never shows up, so finance keeps having to raise a manual adjustment against every renewal we send.",
      "IsPublished": true,
      "CreatedById": "0058W00000LmNoPQAV",
      "CreatedDate": "2026-09-10T14:22:05.000Z"
    }
  ],
  "meta": {
    "window": {
      "from": "2026-09-10T00:00:00Z",
      "to": "2026-09-10T23:59:59Z"
    },
    "rows_returned": 1,
    "row_cap": 200,
    "withheld_comment_count": 1,
    "fields_allowlisted": [
      "Id",
      "ParentId",
      "CommentBody",
      "IsPublished",
      "CreatedById",
      "CreatedDate"
    ],
    "soql": "SELECT Id, ParentId, CommentBody, IsPublished, CreatedById, CreatedDate FROM CaseComment WHERE ParentId = '5008W00002aQpLrQAK' AND IsPublished = true ORDER BY CreatedDate ASC LIMIT 200"
  }
}
